(299599, -6, 4);[10, 30, 200, 90];330;צרלי;78614;(5, 31, 18, 1, 78614);ואנכי;5;(5, 31, 18, 5, 299599);ואנכי הסתר אסתיר פני ביום ההוא על כל הרעה אשר עשה כי פנה אל אלהים אחרים
(47395, -5, 4);[10, 30, 200, 90];330;צרלי;12623;(1, 32, 18, 5, 12623);כי;2;(1, 32, 18, 18, 47395);ויצו את הראשון לאמר כי יפגשך עשו אחי ושאלך לאמר למי אתה ואנה תלך ולמי אלה לפניך
(87070, -5, 4);[10, 30, 200, 90];330;צרלי;22956;(2, 7, 15, 12, 22956);היאר;2;(2, 7, 15, 41, 87070);לך אל פרעה בבקר הנה יצא המימה ונצבת לקראתו על שפת היאר והמטה אשר נהפך לנחש תקח בידך
(251967, -5, 4);[10, 30, 200, 90];330;צרלי;66198;(5, 1, 36, 15, 66198);יען;1;(5, 1, 36, 49, 251967);זולתי כלב בן יפנה הוא יראנה ולו אתן את הארץ אשר דרך בה ולבניו יען אשר מלא אחרי יהוה
(72189, -3, 4);[10, 30, 200, 90];330;צרלי;19084;(1, 47, 6, 3, 19084);לפניך;4;(1, 47, 6, 12, 72189);ארץ מצרים לפניך הוא במיטב הארץ הושב את אביך ואת אחיך ישבו בארץ גשן ואם ידעת ויש בם אנשי חיל ושמתם שרי מקנה על אשר לי
(282466, -2, 4);[10, 30, 200, 90];330;צרלי;74128;(5, 20, 19, 4, 74128);עיר;2;(5, 20, 19, 10, 282466);כי תצור אל עיר ימים רבים להלחם עליה לתפשה לא תשחית את עצה לנדח עליו גרזן כי ממנו תאכל ואתו לא תכרת כי האדם עץ השדה לבא מפניך במצור
