(48373, 95, 4);[90, 200, 30, 10];330;צרלי;12888;(1, 33, 4, 1, 12888);וירץ;4;(1, 33, 4, 4, 48373);וירץ עשו לקראתו ויחבקהו ויפל על צוארו וישקהו ויבכו
(95632, 96, 4);[90, 200, 30, 10];330;צרלי;25230;(2, 12, 28, 6, 25230);צוה;1;(2, 12, 28, 23, 95632);וילכו ויעשו בני ישראל כאשר צוה יהוה את משה ואהרן כן עשו
(179654, 96, 4);[90, 200, 30, 10];330;צרלי;47548;(3, 25, 2, 16, 47548);הארץ;4;(3, 25, 2, 55, 179654);דבר אל בני ישראל ואמרת אלהם כי תבאו אל הארץ אשר אני נתן לכם ושבתה הארץ שבת ליהוה
(268709, 96, 4);[90, 200, 30, 10];330;צרלי;70506;(5, 11, 3, 11, 70506);מצרים;2;(5, 11, 3, 41, 268709);ואת אתתיו ואת מעשיו אשר עשה בתוך מצרים לפרעה מלך מצרים ולכל ארצו
(259086, 97, 4);[90, 200, 30, 10];330;צרלי;68055;(5, 4, 43, 4, 68055);בארץ;4;(5, 4, 43, 14, 259086);את בצר במדבר בארץ המישר לראובני ואת ראמת בגלעד לגדי ואת גולן בבשן למנשי
(8626, 99, 4);[90, 200, 30, 10];330;צרלי;2313;(1, 7, 14, 12, 2313);הארץ;4;(1, 7, 14, 45, 8626);המה וכל החיה למינה וכל הבהמה למינה וכל הרמש הרמש על הארץ למינהו וכל העוף למינהו כל צפור כל כנף
(233614, 99, 4);[90, 200, 30, 10];330;צרלי;61540;(4, 26, 59, 11, 61540);במצרים;3;(4, 26, 59, 37, 233614);ושם אשת עמרם יוכבד בת לוי אשר ילדה אתה ללוי במצרים ותלד לעמרם את אהרן ואת משה ואת מרים אחתם
