(n,d,k);LetterGematriaNumberValue;Letter;LetterPositionIndex;LetterCoordinatesD5K;Found in Word in Text;LetterPositionIndex In Word;WordNumber;WordCoordinatesDWTK;WordNumberInVerse;Found In Verse
(38090, 72, 5);10;י;38090;(1, 27, 38, 2, 38090);ויאמר;2;10123;(1, 27, 38, 1, 10123);1;ויאמר עשו אל אביו הברכה אחת הוא לך אבי ברכני גם אני אבי וישא עשו קלו ויבך
(38090, 72, 5);200;ר;38162;(1, 27, 39, 17, 38162);ויאמר;5;10143;(1, 27, 39, 4, 10143);4;ויען יצחק אביו ויאמר אליו הנה משמני הארץ יהיה מושבך ומטל השמים מעל
(38090, 72, 5);6;ו;38234;(1, 27, 40, 35, 38234);ופרקת;1;10162;(1, 27, 40, 10, 10162);10;ועל חרבך תחיה ואת אחיך תעבד והיה כאשר תריד ופרקת עלו מעל צוארך
(38090, 72, 5);2;ב;38306;(1, 27, 41, 57, 38306);אבי;2;10181;(1, 27, 41, 16, 10181);16;וישטם עשו את יעקב על הברכה אשר ברכו אביו ויאמר עשו בלבו יקרבו ימי אבל אבי ואהרגה את יעקב אחי
(38090, 72, 5);6;ו;38378;(1, 27, 42, 56, 38378);אליו;4;10199;(1, 27, 42, 14, 10199);14;ויגד לרבקה את דברי עשו בנה הגדל ותשלח ותקרא ליעקב בנה הקטן ותאמר אליו הנה עשו אחיך מתנחם לך להרגך
