(n,d,k);LetterGematriaNumberValue;Letter;LetterPositionIndex;LetterCoordinatesD5K;Found in Word in Text;LetterPositionIndex In Word;WordNumber;WordCoordinatesDWTK;WordNumberInVerse;Found In Verse
(160459, -84, 5);10;י;160459;(3, 13, 47, 8, 160459);יהיה;1;42367;(3, 13, 47, 3, 42367);3;והבגד כי יהיה בו נגע צרעת בבגד צמר או בבגד פשתים
(160459, -84, 5);200;ר;160375;(3, 13, 45, 31, 160375);וראשו;2;42343;(3, 13, 45, 8, 42343);8;והצרוע אשר בו הנגע בגדיו יהיו פרמים וראשו יהיה פרוע ועל שפם יעטה וטמא טמא יקרא
(160459, -84, 5);6;ו;160291;(3, 13, 43, 46, 160291);בגבחתו;6;42321;(3, 13, 43, 11, 42321);11;וראה אתו הכהן והנה שאת הנגע לבנה אדמדמת בקרחתו או בגבחתו כמראה צרעת עור בשר
(160459, -84, 5);2;ב;160207;(3, 13, 42, 17, 160207);בגבחת;3;42301;(3, 13, 42, 5, 42301);5;וכי יהיה בקרחת או בגבחת נגע לבן אדמדם צרעת פרחת הוא בקרחתו או בגבחתו
(160459, -84, 5);6;ו;160123;(3, 13, 39, 44, 160123);בעור;3;42277;(3, 13, 39, 12, 42277);12;וראה הכהן והנה בעור בשרם בהרת כהות לבנת בהק הוא פרח בעור טהור הוא
