(n,d,k);LetterGematriaNumberValue;Letter;LetterPositionIndex;LetterCoordinatesD5K;Found in Word in Text;LetterPositionIndex In Word;WordNumber;WordCoordinatesDWTK;WordNumberInVerse;Found In Verse
(39498, 63, 5);10;י;39498;(1, 28, 17, 2, 39498);ויירא;2;10502;(1, 28, 17, 1, 10502);1;ויירא ויאמר מה נורא המקום הזה אין זה כי אם בית אלהים וזה שער השמים
(39498, 63, 5);200;ר;39561;(1, 28, 18, 13, 39561);בבקר;4;10519;(1, 28, 18, 3, 10519);3;וישכם יעקב בבקר ויקח את האבן אשר שם מראשתיו וישם אתה מצבה ויצק שמן על ראשה
(39498, 63, 5);6;ו;39624;(1, 28, 19, 17, 39624);ההוא;3;10537;(1, 28, 19, 5, 10537);5;ויקרא את שם המקום ההוא בית אל ואולם לוז שם העיר לראשנה
(39498, 63, 5);2;ב;39687;(1, 28, 20, 37, 39687);בדרך;1;10554;(1, 28, 20, 10, 10554);10;וידר יעקב נדר לאמר אם יהיה אלהים עמדי ושמרני בדרך הזה אשר אנכי הולך ונתן לי לחם לאכל ובגד ללבש
(39498, 63, 5);6;ו;39750;(1, 28, 21, 25, 39750);יהוה;3;10571;(1, 28, 21, 7, 10571);7;ושבתי בשלום אל בית אבי והיה יהוה לי לאלהים
