(n,d,k);LetterGematriaNumberValue;Letter;LetterPositionIndex;LetterCoordinatesD5K;Found in Word in Text;LetterPositionIndex In Word;WordNumber;WordCoordinatesDWTK;WordNumberInVerse;Found In Verse
(77990, -62, 5);10;י;77990;(1, 50, 25, 27, 77990);יפקד;1;20595;(1, 50, 25, 8, 20595);8;וישבע יוסף את בני ישראל לאמר פקד יפקד אלהים אתכם והעלתם את עצמתי מזה
(77990, -62, 5);200;ר;77928;(1, 50, 24, 52, 77928);הארץ;3;20579;(1, 50, 24, 14, 20579);14;ויאמר יוסף אל אחיו אנכי מת ואלהים פקד יפקד אתכם והעלה אתכם מן הארץ הזאת אל הארץ אשר נשבע לאברהם ליצחק וליעקב
(77990, -62, 5);6;ו;77866;(1, 50, 23, 41, 77866);ילדו;4;20562;(1, 50, 23, 11, 20562);11;וירא יוסף לאפרים בני שלשים גם בני מכיר בן מנשה ילדו על ברכי יוסף
(77990, -62, 5);2;ב;77804;(1, 50, 22, 23, 77804);אביו;2;20546;(1, 50, 22, 6, 20546);6;וישב יוסף במצרים הוא ובית אביו ויחי יוסף מאה ועשר שנים
(77990, -62, 5);6;ו;77742;(1, 50, 21, 11, 77742);תיראו;5;20530;(1, 50, 21, 3, 20530);3;ועתה אל תיראו אנכי אכלכל אתכם ואת טפכם וינחם אותם וידבר על לבם
