(n,d,k);LetterGematriaNumberValue;Letter;LetterPositionIndex;LetterCoordinatesD5K;Found in Word in Text;LetterPositionIndex In Word;WordNumber;WordCoordinatesDWTK;WordNumberInVerse;Found In Verse
(9146, 27, 5);10;י;9146;(1, 8, 1, 9, 9146);אלהים;4;2454;(1, 8, 1, 2, 2454);2;ויזכר אלהים את נח ואת כל החיה ואת כל הבהמה אשר אתו בתבה ויעבר אלהים רוח על הארץ וישכו המים
(9146, 27, 5);200;ר;9173;(1, 8, 1, 36, 9173);אשר;3;2463;(1, 8, 1, 11, 2463);11;ויזכר אלהים את נח ואת כל החיה ואת כל הבהמה אשר אתו בתבה ויעבר אלהים רוח על הארץ וישכו המים
(9146, 27, 5);6;ו;9200;(1, 8, 1, 63, 9200);וישכו;1;2471;(1, 8, 1, 19, 2471);19;ויזכר אלהים את נח ואת כל החיה ואת כל הבהמה אשר אתו בתבה ויעבר אלהים רוח על הארץ וישכו המים
(9146, 27, 5);2;ב;9227;(1, 8, 2, 19, 9227);וארבת;4;2476;(1, 8, 2, 4, 2476);4;ויסכרו מעינת תהום וארבת השמים ויכלא הגשם מן השמים
(9146, 27, 5);6;ו;9254;(1, 8, 3, 5, 9254);וישבו;5;2482;(1, 8, 3, 1, 2482);1;וישבו המים מעל הארץ הלוך ושוב ויחסרו המים מקצה חמשים ומאת יום
