(n,d,k);LetterGematriaNumberValue;Letter;LetterPositionIndex;LetterCoordinatesD5K;Found in Word in Text;LetterPositionIndex In Word;WordNumber;WordCoordinatesDWTK;WordNumberInVerse;Found In Verse
(34196, 69, 5);10;י;34196;(1, 25, 30, 21, 34196);הלעיטני;7;9106;(1, 25, 30, 5, 9106);5;ויאמר עשו אל יעקב הלעיטני נא מן האדם האדם הזה כי עיף אנכי על כן קרא שמו אדום
(34196, 69, 5);200;ר;34265;(1, 25, 32, 5, 34265);ויאמר;5;9127;(1, 25, 32, 1, 9127);1;ויאמר עשו הנה אנכי הולך למות ולמה זה לי בכרה
(34196, 69, 5);6;ו;34334;(1, 25, 33, 39, 34334);בכרתו;5;9146;(1, 25, 33, 10, 9146);10;ויאמר יעקב השבעה לי כיום וישבע לו וימכר את בכרתו ליעקב
(34196, 69, 5);2;ב;34403;(1, 26, 1, 8, 34403);בארץ;1;9164;(1, 26, 1, 3, 9164);3;ויהי רעב בארץ מלבד הרעב הראשון אשר היה בימי אברהם וילך יצחק אל אבימלך מלך פלשתים גררה
(34196, 69, 5);6;ו;34472;(1, 26, 2, 8, 34472);אליו;4;9180;(1, 26, 2, 2, 9180);2;וירא אליו יהוה ויאמר אל תרד מצרימה שכן בארץ אשר אמר אליך
