(n,d,k);LetterGematriaNumberValue;Letter;LetterPositionIndex;LetterCoordinatesD5K;Found in Word in Text;LetterPositionIndex In Word;WordNumber;WordCoordinatesDWTK;WordNumberInVerse;Found In Verse
(239715, -21, 5);10;י;239715;(4, 31, 8, 21, 239715);חלליהם;4;63075;(4, 31, 8, 6, 63075);6;ואת מלכי מדין הרגו על חלליהם את אוי ואת רקם ואת צור ואת חור ואת רבע חמשת מלכי מדין ואת בלעם בן בעור הרגו בחרב
(239715, -21, 5);200;ר;239694;(4, 31, 7, 39, 239694);זכר;3;63069;(4, 31, 7, 11, 63069);11;ויצבאו על מדין כאשר צוה יהוה את משה ויהרגו כל זכר
(239715, -21, 5);6;ו;239673;(4, 31, 7, 18, 239673);צוה;2;63063;(4, 31, 7, 5, 63063);5;ויצבאו על מדין כאשר צוה יהוה את משה ויהרגו כל זכר
(239715, -21, 5);2;ב;239652;(4, 31, 6, 70, 239652);בידו;1;63058;(4, 31, 6, 18, 63058);18;וישלח אתם משה אלף למטה לצבא אתם ואת פינחס בן אלעזר הכהן לצבא וכלי הקדש וחצצרות התרועה בידו
(239715, -21, 5);6;ו;239631;(4, 31, 6, 49, 239631);וכלי;1;63054;(4, 31, 6, 14, 63054);14;וישלח אתם משה אלף למטה לצבא אתם ואת פינחס בן אלעזר הכהן לצבא וכלי הקדש וחצצרות התרועה בידו
