(n,d,k);LetterGematriaNumberValue;Letter;LetterPositionIndex;LetterCoordinatesD5K;Found in Word in Text;LetterPositionIndex In Word;WordNumber;WordCoordinatesDWTK;WordNumberInVerse;Found In Verse
(6956, 46, 5);10;י;6956;(1, 6, 3, 44, 6956);ימיו;3;1853;(1, 6, 3, 12, 1853);12;ויאמר יהוה לא ידון רוחי באדם לעלם בשגם הוא בשר והיו ימיו מאה ועשרים שנה
(6956, 46, 5);200;ר;7002;(1, 6, 4, 33, 7002);אשר;3;1865;(1, 6, 4, 9, 1865);9;הנפלים היו בארץ בימים ההם וגם אחרי כן אשר יבאו בני האלהים אל בנות האדם וילדו להם המה הגברים אשר מעולם אנשי השם
(6956, 46, 5);6;ו;7048;(1, 6, 4, 79, 7048);מעולם;3;1877;(1, 6, 4, 21, 1877);21;הנפלים היו בארץ בימים ההם וגם אחרי כן אשר יבאו בני האלהים אל בנות האדם וילדו להם המה הגברים אשר מעולם אנשי השם
(6956, 46, 5);2;ב;7094;(1, 6, 5, 37, 7094);לבו;2;1890;(1, 6, 5, 11, 1890);11;וירא יהוה כי רבה רעת האדם בארץ וכל יצר מחשבת לבו רק רע כל היום
(6956, 46, 5);6;ו;7140;(1, 6, 6, 35, 7140);לבו;3;1904;(1, 6, 6, 10, 1904);10;וינחם יהוה כי עשה את האדם בארץ ויתעצב אל לבו
