(n,d,k);LetterGematriaNumberValue;Letter;LetterPositionIndex;LetterCoordinatesD5K;Found in Word in Text;LetterPositionIndex In Word;WordNumber;WordCoordinatesDWTK;WordNumberInVerse;Found In Verse
(255077, -78, 5);10;י;255077;(5, 3, 11, 2, 255077);כי;2;67019;(5, 3, 11, 1, 67019);1;כי רק עוג מלך הבשן נשאר מיתר הרפאים הנה ערשו ערש ברזל הלה הוא ברבת בני עמון תשע אמות ארכה וארבע אמות רחבה באמת איש
(255077, -78, 5);200;ר;254999;(5, 3, 9, 14, 254999);לחרמון;3;66999;(5, 3, 9, 3, 66999);3;צידנים יקראו לחרמון שרין והאמרי יקראו לו שניר
(255077, -78, 5);6;ו;254921;(5, 3, 7, 22, 254921);בזונו;5;66978;(5, 3, 7, 5, 66978);5;וכל הבהמה ושלל הערים בזונו לנו
(255077, -78, 5);2;ב;254843;(5, 3, 5, 46, 254843);הרבה;3;66959;(5, 3, 5, 12, 66959);12;כל אלה ערים בצרת חומה גבהה דלתים ובריח לבד מערי הפרזי הרבה מאד
(255077, -78, 5);6;ו;254765;(5, 3, 4, 40, 254765);לקחנו;5;66938;(5, 3, 4, 12, 66938);12;ונלכד את כל עריו בעת ההוא לא היתה קריה אשר לא לקחנו מאתם ששים עיר כל חבל ארגב ממלכת עוג בבשן
