(n,d,k);LetterGematriaNumberValue;Letter;LetterPositionIndex;LetterCoordinatesD5K;Found in Word in Text;LetterPositionIndex In Word;WordNumber;WordCoordinatesDWTK;WordNumberInVerse;Found In Verse
(184496, -98, 5);10;י;184496;(3, 26, 44, 11, 184496);בהיותם;3;48772;(3, 26, 44, 4, 48772);4;ואף גם זאת בהיותם בארץ איביהם לא מאסתים ולא געלתים לכלתם להפר בריתי אתם כי אני יהוה אלהיהם
(184496, -98, 5);200;ר;184398;(3, 26, 42, 51, 184398);אזכר;4;48746;(3, 26, 42, 13, 48746);13;וזכרתי את בריתי יעקוב ואף את בריתי יצחק ואף את בריתי אברהם אזכר והארץ אזכר
(184496, -98, 5);6;ו;184300;(3, 26, 41, 16, 184300);והבאתי;1;48721;(3, 26, 41, 6, 48721);6;אף אני אלך עמם בקרי והבאתי אתם בארץ איביהם או אז יכנע לבבם הערל ואז ירצו את עונם
(184496, -98, 5);2;ב;184202;(3, 26, 39, 21, 184202);בארצת;1;48694;(3, 26, 39, 5, 48694);5;והנשארים בכם ימקו בעונם בארצת איביכם ואף בעונת אבתם אתם ימקו
(184496, -98, 5);6;ו;184104;(3, 26, 37, 5, 184104);וכשלו;5;48671;(3, 26, 37, 1, 48671);1;וכשלו איש באחיו כמפני חרב ורדף אין ולא תהיה לכם תקומה לפני איביכם
