(n,d,k);LetterGematriaNumberValue;Letter;LetterPositionIndex;LetterCoordinatesD5K;Found in Word in Text;LetterPositionIndex In Word;WordNumber;WordCoordinatesDWTK;WordNumberInVerse;Found In Verse
(285429, 75, 5);10;י;285429;(5, 22, 27, 27, 285429);ואין;3;74934;(5, 22, 27, 7, 74934);7;כי בשדה מצאה צעקה הנער המארשה ואין מושיע לה
(285429, 75, 5);200;ר;285504;(5, 22, 29, 23, 285504);הנער;4;74954;(5, 22, 29, 6, 74954);6;ונתן האיש השכב עמה לאבי הנער חמשים כסף ולו תהיה לאשה תחת אשר ענה לא יוכל שלחה כל ימיו
(285429, 75, 5);6;ו;285579;(5, 23, 1, 31, 285579);אביו;4;74977;(5, 23, 1, 10, 74977);10;לא יקח איש את אשת אביו ולא יגלה כנף אביו
(285429, 75, 5);2;ב;285654;(5, 23, 4, 4, 285654);יבא;2;75000;(5, 23, 4, 2, 75000);2;לא יבא עמוני ומואבי בקהל יהוה גם דור עשירי לא יבא להם בקהל יהוה עד עולם
(285429, 75, 5);6;ו;285729;(5, 23, 5, 23, 285729);ובמים;1;75022;(5, 23, 5, 8, 75022);8;על דבר אשר לא קדמו אתכם בלחם ובמים בדרך בצאתכם ממצרים ואשר שכר עליך את בלעם בן בעור מפתור ארם נהרים לקללך
