(n,d,k);LetterGematriaNumberValue;Letter;LetterPositionIndex;LetterCoordinatesD5K;Found in Word in Text;LetterPositionIndex In Word;WordNumber;WordCoordinatesDWTK;WordNumberInVerse;Found In Verse
(66185, -38, 5);10;י;66185;(1, 43, 20, 12, 66185);אדני;4;17543;(1, 43, 20, 3, 17543);3;ויאמרו בי אדני ירד ירדנו בתחלה לשבר אכל
(66185, -38, 5);200;ר;66147;(1, 43, 19, 14, 66147);אשר;3;17533;(1, 43, 19, 4, 17533);4;ויגשו אל האיש אשר על בית יוסף וידברו אליו פתח הבית
(66185, -38, 5);6;ו;66109;(1, 43, 18, 92, 66109);עלינו;5;17524;(1, 43, 18, 19, 17524);19;וייראו האנשים כי הובאו בית יוסף ויאמרו על דבר הכסף השב באמתחתינו בתחלה אנחנו מובאים להתגלל עלינו ולהתנפל עלינו ולקחת אתנו לעבדים ואת חמרינו
(66185, -38, 5);2;ב;66071;(1, 43, 18, 54, 66071);בתחלה;1;17518;(1, 43, 18, 13, 17518);13;וייראו האנשים כי הובאו בית יוסף ויאמרו על דבר הכסף השב באמתחתינו בתחלה אנחנו מובאים להתגלל עלינו ולהתנפל עלינו ולקחת אתנו לעבדים ואת חמרינו
(66185, -38, 5);6;ו;66033;(1, 43, 18, 16, 66033);הובאו;2;17509;(1, 43, 18, 4, 17509);4;וייראו האנשים כי הובאו בית יוסף ויאמרו על דבר הכסף השב באמתחתינו בתחלה אנחנו מובאים להתגלל עלינו ולהתנפל עלינו ולקחת אתנו לעבדים ואת חמרינו
