(n,d,k);LetterGematriaNumberValue;Letter;LetterPositionIndex;LetterCoordinatesD5K;Found in Word in Text;LetterPositionIndex In Word;WordNumber;WordCoordinatesDWTK;WordNumberInVerse;Found In Verse
(156976, 52, 5);10;י;156976;(3, 11, 36, 5, 156976);מעין;3;41427;(3, 11, 36, 2, 41427);2;אך מעין ובור מקוה מים יהיה טהור ונגע בנבלתם יטמא
(156976, 52, 5);200;ר;157028;(3, 11, 37, 18, 157028);זרע;2;41441;(3, 11, 37, 6, 41441);6;וכי יפל מנבלתם על כל זרע זרוע אשר יזרע טהור הוא
(156976, 52, 5);6;ו;157080;(3, 11, 38, 33, 157080);הוא;2;41456;(3, 11, 38, 10, 41456);10;וכי יתן מים על זרע ונפל מנבלתם עליו טמא הוא לכם
(156976, 52, 5);2;ב;157132;(3, 11, 39, 48, 157132);הערב;4;41470;(3, 11, 39, 13, 41470);13;וכי ימות מן הבהמה אשר היא לכם לאכלה הנגע בנבלתה יטמא עד הערב
(156976, 52, 5);6;ו;157184;(3, 11, 40, 52, 157184);וטמא;1;41483;(3, 11, 40, 13, 41483);13;והאכל מנבלתה יכבס בגדיו וטמא עד הערב והנשא את נבלתה יכבס בגדיו וטמא עד הערב
