(n,d,k);LetterGematriaNumberValue;Letter;LetterPositionIndex;LetterCoordinatesD5K;Found in Word in Text;LetterPositionIndex In Word;WordNumber;WordCoordinatesDWTK;WordNumberInVerse;Found In Verse
(135317, -33, 5);10;י;135317;(2, 37, 13, 19, 135317);ויתן;2;35689;(2, 37, 13, 6, 35689);6;ויצק לו ארבע טבעת זהב ויתן את הטבעת על ארבע הפאת אשר לארבע רגליו
(135317, -33, 5);200;ר;135284;(2, 37, 12, 24, 135284);זר;2;35680;(2, 37, 12, 7, 35680);7;ויעש לו מסגרת טפח סביב ויעש זר זהב למסגרתו סביב
(135317, -33, 5);6;ו;135251;(2, 37, 11, 20, 135251);לו;2;35670;(2, 37, 11, 6, 35670);6;ויצף אתו זהב טהור ויעש לו זר זהב סביב
(135317, -33, 5);2;ב;135218;(2, 37, 10, 34, 135218);רחבו;3;35661;(2, 37, 10, 9, 35661);9;ויעש את השלחן עצי שטים אמתים ארכו ואמה רחבו ואמה וחצי קמתו
(135317, -33, 5);6;ו;135185;(2, 37, 10, 1, 135185);ויעש;1;35653;(2, 37, 10, 1, 35653);1;ויעש את השלחן עצי שטים אמתים ארכו ואמה רחבו ואמה וחצי קמתו
