(n,d,k);LetterGematriaNumberValue;Letter;LetterPositionIndex;LetterCoordinatesD5K;Found in Word in Text;LetterPositionIndex In Word;WordNumber;WordCoordinatesDWTK;WordNumberInVerse;Found In Verse
(57484, 72, 5);10;י;57484;(1, 38, 29, 43, 57484);ויקרא;2;15281;(1, 38, 29, 12, 15281);12;ויהי כמשיב ידו והנה יצא אחיו ותאמר מה פרצת עליך פרץ ויקרא שמו פרץ
(57484, 72, 5);200;ר;57556;(1, 39, 1, 29, 57556);סריס;2;15299;(1, 39, 1, 6, 15299);6;ויוסף הורד מצרימה ויקנהו פוטיפר סריס פרעה שר הטבחים איש מצרי מיד הישמעאלים אשר הורדהו שמה
(57484, 72, 5);6;ו;57628;(1, 39, 2, 27, 57628);ויהי;1;15317;(1, 39, 2, 8, 15317);8;ויהי יהוה את יוסף ויהי איש מצליח ויהי בבית אדניו המצרי
(57484, 72, 5);2;ב;57700;(1, 39, 4, 12, 57700);בעיניו;1;15336;(1, 39, 4, 4, 15336);4;וימצא יוסף חן בעיניו וישרת אתו ויפקדהו על ביתו וכל יש לו נתן בידו
(57484, 72, 5);6;ו;57772;(1, 39, 5, 32, 57772);לו;2;15356;(1, 39, 5, 10, 15356);10;ויהי מאז הפקיד אתו בביתו ועל כל אשר יש לו ויברך יהוה את בית המצרי בגלל יוסף ויהי ברכת יהוה בכל אשר יש לו בבית ובשדה
