(n,d,k);LetterGematriaNumberValue;Letter;LetterPositionIndex;LetterCoordinatesD5K;Found in Word in Text;LetterPositionIndex In Word;WordNumber;WordCoordinatesDWTK;WordNumberInVerse;Found In Verse
(210549, 96, 5);10;י;210549;(4, 13, 27, 55, 210549);פריה;3;55495;(4, 13, 27, 15, 55495);15;ויספרו לו ויאמרו באנו אל הארץ אשר שלחתנו וגם זבת חלב ודבש הוא וזה פריה
(210549, 96, 5);200;ר;210645;(4, 13, 29, 41, 210645);בהר;3;55519;(4, 13, 29, 9, 55519);9;עמלק יושב בארץ הנגב והחתי והיבוסי והאמרי יושב בהר והכנעני יושב על הים ועל יד הירדן
(210549, 96, 5);6;ו;210741;(4, 13, 31, 20, 210741);אמרו;4;55546;(4, 13, 31, 5, 55546);5;והאנשים אשר עלו עמו אמרו לא נוכל לעלות אל העם כי חזק הוא ממנו
(210549, 96, 5);2;ב;210837;(4, 13, 32, 68, 210837);יושביה;4;55574;(4, 13, 32, 19, 55574);19;ויציאו דבת הארץ אשר תרו אתה אל בני ישראל לאמר הארץ אשר עברנו בה לתור אתה ארץ אכלת יושביה הוא וכל העם אשר ראינו בתוכה אנשי מדות
(210549, 96, 5);6;ו;210933;(4, 14, 1, 1, 210933);ותשא;1;55597;(4, 14, 1, 1, 55597);1;ותשא כל העדה ויתנו את קולם ויבכו העם בלילה ההוא
