(n,d,k);LetterGematriaNumberValue;Letter;LetterPositionIndex;LetterCoordinatesD5K;Found in Word in Text;LetterPositionIndex In Word;WordNumber;WordCoordinatesDWTK;WordNumberInVerse;Found In Verse
(254366, -22, 5);10;י;254366;(5, 2, 35, 23, 254366);הערים;4;66826;(5, 2, 35, 6, 66826);6;רק הבהמה בזזנו לנו ושלל הערים אשר לכדנו
(254366, -22, 5);200;ר;254344;(5, 2, 35, 1, 254344);רק;1;66821;(5, 2, 35, 1, 66821);1;רק הבהמה בזזנו לנו ושלל הערים אשר לכדנו
(254366, -22, 5);6;ו;254322;(5, 2, 34, 36, 254322);והנשים;1;66816;(5, 2, 34, 12, 66816);12;ונלכד את כל עריו בעת ההוא ונחרם את כל עיר מתם והנשים והטף לא השארנו שריד
(254366, -22, 5);2;ב;254300;(5, 2, 34, 14, 254300);בעת;1;66809;(5, 2, 34, 5, 66809);5;ונלכד את כל עריו בעת ההוא ונחרם את כל עיר מתם והנשים והטף לא השארנו שריד
(254366, -22, 5);6;ו;254278;(5, 2, 33, 34, 254278);בנו;3;66801;(5, 2, 33, 8, 66801);8;ויתנהו יהוה אלהינו לפנינו ונך אתו ואת בנו ואת כל עמו
