(n,d,k);LetterGematriaNumberValue;Letter;LetterPositionIndex;LetterCoordinatesD5K;Found in Word in Text;LetterPositionIndex In Word;WordNumber;WordCoordinatesDWTK;WordNumberInVerse;Found In Verse
(304271, 93, 5);10;י;304271;(5, 34, 2, 43, 304271);הים;2;79835;(5, 34, 2, 13, 79835);13;ואת כל נפתלי ואת ארץ אפרים ומנשה ואת כל ארץ יהודה עד הים האחרון
(304271, 93, 5);200;ר;304364;(5, 34, 4, 50, 304364);לאמר;4;79857;(5, 34, 4, 11, 79857);11;ויאמר יהוה אליו זאת הארץ אשר נשבעתי לאברהם ליצחק וליעקב לאמר לזרעך אתננה הראיתיך בעיניך ושמה לא תעבר
(304271, 93, 5);6;ו;304457;(5, 34, 6, 28, 304457);פעור;3;79882;(5, 34, 6, 8, 79882);8;ויקבר אתו בגי בארץ מואב מול בית פעור ולא ידע איש את קברתו עד היום הזה
(304271, 93, 5);2;ב;304550;(5, 34, 8, 27, 304550);מואב;4;79909;(5, 34, 8, 7, 79909);7;ויבכו בני ישראל את משה בערבת מואב שלשים יום ויתמו ימי בכי אבל משה
(304271, 93, 5);6;ו;304643;(5, 34, 9, 68, 304643);צוה;2;79935;(5, 34, 9, 19, 79935);19;ויהושע בן נון מלא רוח חכמה כי סמך משה את ידיו עליו וישמעו אליו בני ישראל ויעשו כאשר צוה יהוה את משה
