(n,d,k);LetterGematriaNumberValue;Letter;LetterPositionIndex;LetterCoordinatesD5K;Found in Word in Text;LetterPositionIndex In Word;WordNumber;WordCoordinatesDWTK;WordNumberInVerse;Found In Verse
(286597, 25, 5);10;י;286597;(5, 23, 22, 48, 286597);אלהיך;4;75258;(5, 23, 22, 13, 75258);13;כי תדר נדר ליהוה אלהיך לא תאחר לשלמו כי דרש ידרשנו יהוה אלהיך מעמך והיה בך חטא
(286597, 25, 5);200;ר;286622;(5, 23, 23, 11, 286622);לנדר;4;75265;(5, 23, 23, 3, 75265);3;וכי תחדל לנדר לא יהיה בך חטא
(286597, 25, 5);6;ו;286647;(5, 23, 24, 14, 286647);ועשית;1;75273;(5, 23, 24, 4, 75273);4;מוצא שפתיך תשמר ועשית כאשר נדרת ליהוה אלהיך נדבה אשר דברת בפיך
(286597, 25, 5);2;ב;286672;(5, 23, 24, 39, 286672);נדבה;3;75278;(5, 23, 24, 9, 75278);9;מוצא שפתיך תשמר ועשית כאשר נדרת ליהוה אלהיך נדבה אשר דברת בפיך
(286597, 25, 5);6;ו;286697;(5, 23, 25, 13, 286697);ואכלת;1;75286;(5, 23, 25, 5, 75286);5;כי תבא בכרם רעך ואכלת ענבים כנפשך שבעך ואל כליך לא תתן
