(n,d,k);LetterGematriaNumberValue;Letter;LetterPositionIndex;LetterCoordinatesD5K;Found in Word in Text;LetterPositionIndex In Word;WordNumber;WordCoordinatesDWTK;WordNumberInVerse;Found In Verse
(176686, -65, 5);10;י;176686;(3, 23, 12, 13, 176686);הניפכם;3;46792;(3, 23, 12, 3, 46792);3;ועשיתם ביום הניפכם את העמר כבש תמים בן שנתו לעלה ליהוה
(176686, -65, 5);200;ר;176621;(3, 23, 10, 79, 176621);קצירכם;4;46777;(3, 23, 10, 22, 46777);22;דבר אל בני ישראל ואמרת אלהם כי תבאו אל הארץ אשר אני נתן לכם וקצרתם את קצירה והבאתם את עמר ראשית קצירכם אל הכהן
(176686, -65, 5);6;ו;176556;(3, 23, 10, 14, 176556);ואמרת;1;46760;(3, 23, 10, 5, 46760);5;דבר אל בני ישראל ואמרת אלהם כי תבאו אל הארץ אשר אני נתן לכם וקצרתם את קצירה והבאתם את עמר ראשית קצירכם אל הכהן
(176686, -65, 5);2;ב;176491;(3, 23, 8, 24, 176491);ביום;1;46742;(3, 23, 8, 6, 46742);6;והקרבתם אשה ליהוה שבעת ימים ביום השביעי מקרא קדש כל מלאכת עבדה לא תעשו
(176686, -65, 5);6;ו;176426;(3, 23, 6, 48, 176426);תאכלו;5;46725;(3, 23, 6, 12, 46725);12;ובחמשה עשר יום לחדש הזה חג המצות ליהוה שבעת ימים מצות תאכלו
