(137833, -28, 3);[200, 90, 8];298;רצח;36316;(2, 38, 31, 16, 36316);החצר;4;(2, 38, 31, 56, 137833);ואת אדני החצר סביב ואת אדני שער החצר ואת כל יתדת המשכן ואת כל יתדת החצר סביב
(166226, -28, 3);[200, 90, 8];298;רצח;43953;(3, 16, 5, 4, 43953);ישראל;3;(3, 16, 5, 13, 166226);ומאת עדת בני ישראל יקח שני שעירי עזים לחטאת ואיל אחד לעלה
(214984, -28, 3);[200, 90, 8];298;רצח;56669;(4, 15, 36, 12, 56669);כאשר;4;(4, 15, 36, 49, 214984);ויציאו אתו כל העדה אל מחוץ למחנה וירגמו אתו באבנים וימת כאשר צוה יהוה את משה
(222821, -28, 3);[200, 90, 8];298;רצח;58744;(4, 20, 17, 11, 58744);באר;3;(4, 20, 17, 39, 222821);נעברה נא בארצך לא נעבר בשדה ובכרם ולא נשתה מי באר דרך המלך נלך לא נטה ימין ושמאול עד אשר נעבר גבלך
(235849, -28, 3);[200, 90, 8];298;רצח;62123;(4, 28, 14, 9, 62123);ורביעת;2;(4, 28, 14, 37, 235849);ונסכיהם חצי ההין יהיה לפר ושלישת ההין לאיל ורביעת ההין לכבש יין זאת עלת חדש בחדשו לחדשי השנה
(246715, -28, 3);[200, 90, 8];298;רצח;64843;(4, 34, 13, 9, 64843);אשר;3;(4, 34, 13, 31, 246715);ויצו משה את בני ישראל לאמר זאת הארץ אשר תתנחלו אתה בגורל אשר צוה יהוה לתת לתשעת המטות וחצי המטה
(248213, -28, 3);[200, 90, 8];298;רצח;65226;(4, 35, 18, 5, 65226);אשר;3;(4, 35, 18, 13, 248213);או בכלי עץ יד אשר ימות בו הכהו וימת רצח הוא מות יומת הרצח
(267111, -28, 3);[200, 90, 8];298;רצח;70096;(5, 9, 27, 3, 70096);לאברהם;4;(5, 9, 27, 13, 267111);זכר לעבדיך לאברהם ליצחק וליעקב אל תפן אל קשי העם הזה ואל רשעו ואל חטאתו
(14192, -27, 3);[200, 90, 8];298;רצח;3805;(1, 12, 1, 13, 3805);אשר;3;(1, 12, 1, 50, 14192);ויאמר יהוה אל אברם לך לך מארצך וממולדתך ומבית אביך אל הארץ אשר אראך
(95713, -27, 3);[200, 90, 8];298;רצח;25252;(2, 12, 29, 16, 25252);בכור;4;(2, 12, 29, 60, 95713);ויהי בחצי הלילה ויהוה הכה כל בכור בארץ מצרים מבכר פרעה הישב על כסאו עד בכור השבי אשר בבית הבור וכל בכור בהמה
(280453, -27, 3);[200, 90, 8];298;רצח;73581;(5, 19, 4, 8, 73581);אשר;3;(5, 19, 4, 26, 280453);וזה דבר הרצח אשר ינוס שמה וחי אשר יכה את רעהו בבלי דעת והוא לא שנא לו מתמל שלשם
(284537, -27, 3);[200, 90, 8];298;רצח;74695;(5, 22, 12, 5, 74695);ארבע;2;(5, 22, 12, 15, 284537);גדלים תעשה לך על ארבע כנפות כסותך אשר תכסה בה
(38204, -26, 3);[200, 90, 8];298;רצח;10154;(1, 27, 40, 2, 10154);חרבך;2;(1, 27, 40, 5, 38204);ועל חרבך תחיה ואת אחיך תעבד והיה כאשר תריד ופרקת עלו מעל צוארך
(104511, -26, 3);[200, 90, 8];298;רצח;27570;(2, 18, 8, 17, 27570);אשר;3;(2, 18, 8, 62, 104511);ויספר משה לחתנו את כל אשר עשה יהוה לפרעה ולמצרים על אודת ישראל את כל התלאה אשר מצאתם בדרך ויצלם יהוה
(163684, -26, 3);[200, 90, 8];298;רצח;43255;(3, 14, 44, 3, 43255);וראה;2;(3, 14, 44, 9, 163684);ובא הכהן וראה והנה פשה הנגע בבית צרעת ממארת הוא בבית טמא הוא
(186472, -26, 3);[200, 90, 8];298;רצח;49299;(4, 1, 2, 7, 49299);ישראל;3;(4, 1, 2, 19, 186472);שאו את ראש כל עדת בני ישראל למשפחתם לבית אבתם במספר שמות כל זכר לגלגלתם
(248774, -26, 3);[200, 90, 8];298;רצח;65387;(4, 35, 29, 6, 65387);לדרתיכם;3;(4, 35, 29, 21, 248774);והיו אלה לכם לחקת משפט לדרתיכם בכל מושבתיכם
(283886, -26, 3);[200, 90, 8];298;רצח;74514;(5, 21, 23, 8, 74514);תקברנו;4;(5, 21, 23, 26, 283886);לא תלין נבלתו על העץ כי קבור תקברנו ביום ההוא כי קללת אלהים תלוי ולא תטמא את אדמתך אשר יהוה אלהיך נתן לך נחלה
(48133, -25, 3);[200, 90, 8];298;רצח;12823;(1, 32, 33, 6, 12823);ישראל;3;(1, 32, 33, 17, 48133);על כן לא יאכלו בני ישראל את גיד הנשה אשר על כף הירך עד היום הזה כי נגע בכף ירך יעקב בגיד הנשה
(94558, -25, 3);[200, 90, 8];298;רצח;24954;(2, 12, 12, 8, 24954);בכור;4;(2, 12, 12, 35, 94558);ועברתי בארץ מצרים בלילה הזה והכיתי כל בכור בארץ מצרים מאדם ועד בהמה ובכל אלהי מצרים אעשה שפטים אני יהוה
(154948, -25, 3);[200, 90, 8];298;רצח;40880;(3, 10, 14, 6, 40880);התרומה;3;(3, 10, 14, 21, 154948);ואת חזה התנופה ואת שוק התרומה תאכלו במקום טהור אתה ובניך ובנתיך אתך כי חקך וחק בניך נתנו מזבחי שלמי בני ישראל
(99358, -24, 3);[200, 90, 8];298;רצח;26210;(2, 14, 23, 8, 26210);רכבו;1;(2, 14, 23, 32, 99358);וירדפו מצרים ויבאו אחריהם כל סוס פרעה רכבו ופרשיו אל תוך הים
(113040, -24, 3);[200, 90, 8];298;רצח;29922;(2, 24, 11, 4, 29922);ישראל;3;(2, 24, 11, 14, 113040);ואל אצילי בני ישראל לא שלח ידו ויחזו את האלהים ויאכלו וישתו
(136411, -24, 3);[200, 90, 8];298;רצח;35968;(2, 38, 5, 6, 35968);למכבר;5;(2, 38, 5, 27, 136411);ויצק ארבע טבעת בארבע הקצות למכבר הנחשת בתים לבדים
(118503, -23, 3);[200, 90, 8];298;רצח;31268;(2, 28, 4, 15, 31268);לאהרן;4;(2, 28, 4, 64, 118503);ואלה הבגדים אשר יעשו חשן ואפוד ומעיל וכתנת תשבץ מצנפת ואבנט ועשו בגדי קדש לאהרן אחיך ולבניו לכהנו לי
(129313, -23, 3);[200, 90, 8];298;רצח;34133;(2, 34, 6, 1, 34133);ויעבר;5;(2, 34, 6, 5, 129313);ויעבר יהוה על פניו ויקרא יהוה יהוה אל רחום וחנון ארך אפים ורב חסד ואמת
(225009, -23, 3);[200, 90, 8];298;רצח;59325;(4, 21, 32, 5, 59325);יעזר;4;(4, 21, 32, 18, 225009);וישלח משה לרגל את יעזר וילכדו בנתיה ויירש את האמרי אשר שם
(243689, -23, 3);[200, 90, 8];298;רצח;64100;(4, 32, 32, 11, 64100);מעבר;4;(4, 32, 32, 48, 243689);נחנו נעבר חלוצים לפני יהוה ארץ כנען ואתנו אחזת נחלתנו מעבר לירדן
(92592, -22, 3);[200, 90, 8];298;רצח;24419;(2, 10, 15, 19, 24419);הברד;3;(2, 10, 15, 62, 92592);ויכס את עין כל הארץ ותחשך הארץ ויאכל את כל עשב הארץ ואת כל פרי העץ אשר הותיר הברד ולא נותר כל ירק בעץ ובעשב השדה בכל ארץ מצרים
(147023, -22, 3);[200, 90, 8];298;רצח;38779;(3, 5, 12, 10, 38779);אזכרתה;4;(3, 5, 12, 38, 147023);והביאה אל הכהן וקמץ הכהן ממנה מלוא קמצו את אזכרתה והקטיר המזבחה על אשי יהוה חטאת הוא
(153548, -22, 3);[200, 90, 8];298;רצח;40520;(3, 9, 12, 10, 40520);ויזרקהו;4;(3, 9, 12, 37, 153548);וישחט את העלה וימצאו בני אהרן אליו את הדם ויזרקהו על המזבח סביב
(286195, -22, 3);[200, 90, 8];298;רצח;75150;(5, 23, 15, 5, 75150);בקרב;3;(5, 23, 15, 19, 286195);כי יהוה אלהיך מתהלך בקרב מחנך להצילך ולתת איביך לפניך והיה מחניך קדוש ולא יראה בך ערות דבר ושב מאחריך
(287194, -22, 3);[200, 90, 8];298;רצח;75424;(5, 24, 7, 8, 75424);ישראל;3;(5, 24, 7, 27, 287194);כי ימצא איש גנב נפש מאחיו מבני ישראל והתעמר בו ומכרו ומת הגנב ההוא ובערת הרע מקרבך
(303808, -22, 3);[200, 90, 8];298;רצח;79713;(5, 33, 21, 17, 79713);ישראל;3;(5, 33, 21, 60, 303808);וירא ראשית לו כי שם חלקת מחקק ספון ויתא ראשי עם צדקת יהוה עשה ומשפטיו עם ישראל
(10265, -21, 3);[200, 90, 8];298;רצח;2756;(1, 8, 22, 10, 2756);וחרף;3;(1, 8, 22, 32, 10265);עד כל ימי הארץ זרע וקציר וקר וחם וקיץ וחרף ויום ולילה לא ישבתו
(112825, -21, 3);[200, 90, 8];298;רצח;29868;(2, 24, 7, 2, 29868);ספר;3;(2, 24, 7, 7, 112825);ויקח ספר הברית ויקרא באזני העם ויאמרו כל אשר דבר יהוה נעשה ונשמע
(115912, -21, 3);[200, 90, 8];298;רצח;30640;(2, 26, 12, 10, 30640);אחרי;3;(2, 26, 12, 41, 115912);וסרח העדף ביריעת האהל חצי היריעה העדפת תסרח על אחרי המשכן
(208993, -21, 3);[200, 90, 8];298;רצח;55074;(4, 12, 6, 4, 55074);דברי;3;(4, 12, 6, 14, 208993);ויאמר שמעו נא דברי אם יהיה נביאכם יהוה במראה אליו אתודע בחלום אדבר בו
(290901, -21, 3);[200, 90, 8];298;רצח;76372;(5, 27, 11, 7, 76372);לאמר;4;(5, 27, 11, 24, 290901);ויצו משה את העם ביום ההוא לאמר
(35320, -20, 3);[200, 90, 8];298;רצח;9396;(1, 26, 18, 7, 9396);אשר;3;(1, 26, 18, 26, 35320);וישב יצחק ויחפר את בארת המים אשר חפרו בימי אברהם אביו ויסתמום פלשתים אחרי מות אברהם ויקרא להן שמות כשמת אשר קרא להן אביו
(88114, -20, 3);[200, 90, 8];298;רצח;23227;(2, 8, 4, 1, 23227);ויקרא;4;(2, 8, 4, 4, 88114);ויקרא פרעה למשה ולאהרן ויאמר העתירו אל יהוה ויסר הצפרדעים ממני ומעמי ואשלחה את העם ויזבחו ליהוה
(97780, -20, 3);[200, 90, 8];298;רצח;25807;(2, 13, 18, 5, 25807);דרך;2;(2, 13, 18, 16, 97780);ויסב אלהים את העם דרך המדבר ים סוף וחמשים עלו בני ישראל מארץ מצרים
(217069, -20, 3);[200, 90, 8];298;רצח;57215;(4, 16, 34, 2, 57215);ישראל;3;(4, 16, 34, 6, 217069);וכל ישראל אשר סביבתיהם נסו לקלם כי אמרו פן תבלענו הארץ
(251664, -20, 3);[200, 90, 8];298;רצח;66120;(5, 1, 31, 3, 66120);ראית;1;(5, 1, 31, 10, 251664);ובמדבר אשר ראית אשר נשאך יהוה אלהיך כאשר ישא איש את בנו בכל הדרך אשר הלכתם עד באכם עד המקום הזה
(275998, -20, 3);[200, 90, 8];298;רצח;72392;(5, 15, 14, 8, 72392);ברכך;2;(5, 15, 14, 34, 275998);העניק תעניק לו מצאנך ומגרנך ומיקבך אשר ברכך יהוה אלהיך תתן לו
(280623, -20, 3);[200, 90, 8];298;רצח;73631;(5, 19, 6, 12, 73631);ירבה;2;(5, 19, 6, 39, 280623);פן ירדף גאל הדם אחרי הרצח כי יחם לבבו והשיגו כי ירבה הדרך והכהו נפש ולו אין משפט מות כי לא שנא הוא לו מתמול שלשום
(42615, -19, 3);[200, 90, 8];298;רצח;11362;(1, 30, 26, 6, 11362);אשר;3;(1, 30, 26, 18, 42615);תנה את נשי ואת ילדי אשר עבדתי אתך בהן ואלכה כי אתה ידעת את עבדתי אשר עבדתיך
(135093, -19, 3);[200, 90, 8];298;רצח;35632;(2, 37, 8, 13, 35632);הכרבים;3;(2, 37, 8, 44, 135093);כרוב אחד מקצה מזה וכרוב אחד מקצה מזה מן הכפרת עשה את הכרבים משני קצוותו
(116598, -18, 3);[200, 90, 8];298;רצח;30805;(2, 26, 27, 2, 30805);בריחם;2;(2, 26, 27, 7, 116598);וחמשה בריחם לקרשי צלע המשכן השנית וחמשה בריחם לקרשי צלע המשכן לירכתים ימה
(126133, -18, 3);[200, 90, 8];298;רצח;33264;(2, 32, 8, 5, 33264);אשר;3;(2, 32, 8, 15, 126133);סרו מהר מן הדרך אשר צויתם עשו להם עגל מסכה וישתחוו לו ויזבחו לו ויאמרו אלה אלהיך ישראל אשר העלוך מארץ מצרים
(134388, -18, 3);[200, 90, 8];298;רצח;35452;(2, 36, 32, 2, 35452);בריחם;2;(2, 36, 32, 7, 134388);וחמשה בריחם לקרשי צלע המשכן השנית וחמשה בריחם לקרשי המשכן לירכתים ימה
(299912, -18, 3);[200, 90, 8];298;רצח;78697;(5, 31, 21, 26, 78697);בטרם;3;(5, 31, 21, 93, 299912);והיה כי תמצאן אתו רעות רבות וצרות וענתה השירה הזאת לפניו לעד כי לא תשכח מפי זרעו כי ידעתי את יצרו אשר הוא עשה היום בטרם אביאנו אל הארץ אשר נשבעתי
(302190, -18, 3);[200, 90, 8];298;רצח;79287;(5, 32, 42, 1, 79287);אשכיר;5;(5, 32, 42, 5, 302190);אשכיר חצי מדם וחרבי תאכל בשר מדם חלל ושביה מראש פרעות אויב
(72002, -17, 3);[200, 90, 8];298;רצח;19035;(1, 47, 3, 2, 19035);פרעה;2;(1, 47, 3, 7, 72002);ויאמר פרעה אל אחיו מה מעשיכם ויאמרו אל פרעה רעה צאן עבדיך גם אנחנו גם אבותינו
(72518, -17, 3);[200, 90, 8];298;רצח;19173;(1, 47, 11, 14, 19173);בארץ;3;(1, 47, 11, 54, 72518);ויושב יוסף את אביו ואת אחיו ויתן להם אחזה בארץ מצרים במיטב הארץ בארץ רעמסס כאשר צוה פרעה
(112725, -17, 3);[200, 90, 8];298;רצח;29843;(2, 24, 4, 19, 29843);ישראל;3;(2, 24, 4, 71, 112725);ויכתב משה את כל דברי יהוה וישכם בבקר ויבן מזבח תחת ההר ושתים עשרה מצבה לשנים עשר שבטי ישראל
(194017, -17, 3);[200, 90, 8];298;רצח;51163;(4, 4, 26, 8, 51163);החצר;4;(4, 4, 26, 27, 194017);ואת קלעי החצר ואת מסך פתח שער החצר אשר על המשכן ועל המזבח סביב ואת מיתריהם ואת כל כלי עבדתם ואת כל אשר יעשה להם ועבדו
(205916, -17, 3);[200, 90, 8];298;רצח;54260;(4, 10, 18, 10, 54260);שדיאור;6;(4, 10, 18, 43, 205916);ונסע דגל מחנה ראובן לצבאתם ועל צבאו אליצור בן שדיאור
(70332, -16, 3);[200, 90, 8];298;רצח;18609;(1, 46, 2, 3, 18609);לישראל;4;(1, 46, 2, 14, 70332);ויאמר אלהים לישראל במראת הלילה ויאמר יעקב יעקב ויאמר הנני
(88502, -16, 3);[200, 90, 8];298;רצח;23317;(2, 8, 11, 5, 23317);הרוחה;2;(2, 8, 11, 16, 88502);וירא פרעה כי היתה הרוחה והכבד את לבו ולא שמע אלהם כאשר דבר יהוה
(126129, -16, 3);[200, 90, 8];298;רצח;33263;(2, 32, 8, 4, 33263);הדרך;3;(2, 32, 8, 11, 126129);סרו מהר מן הדרך אשר צויתם עשו להם עגל מסכה וישתחוו לו ויזבחו לו ויאמרו אלה אלהיך ישראל אשר העלוך מארץ מצרים
(158693, -16, 3);[200, 90, 8];298;רצח;41887;(3, 13, 12, 12, 41887);מראשו;2;(3, 13, 12, 43, 158693);ואם פרוח תפרח הצרעת בעור וכסתה הצרעת את כל עור הנגע מראשו ועד רגליו לכל מראה עיני הכהן
(212224, -16, 3);[200, 90, 8];298;רצח;55946;(4, 14, 24, 17, 55946);יורשנה;3;(4, 14, 24, 64, 212224);ועבדי כלב עקב היתה רוח אחרת עמו וימלא אחרי והביאתיו אל הארץ אשר בא שמה וזרעו יורשנה
(227543, -16, 3);[200, 90, 8];298;רצח;60024;(4, 22, 40, 7, 60024);ולשרים;4;(4, 22, 40, 29, 227543);ויזבח בלק בקר וצאן וישלח לבלעם ולשרים אשר אתו
(10725, -15, 3);[200, 90, 8];298;רצח;2885;(1, 9, 10, 18, 2885);הארץ;3;(1, 9, 10, 63, 10725);ואת כל נפש החיה אשר אתכם בעוף בבהמה ובכל חית הארץ אתכם מכל יצאי התבה לכל חית הארץ
(21709, -15, 3);[200, 90, 8];298;רצח;5799;(1, 18, 26, 1, 5799);ויאמר;5;(1, 18, 26, 5, 21709);ויאמר יהוה אם אמצא בסדם חמשים צדיקם בתוך העיר ונשאתי לכל המקום בעבורם
(62874, -15, 3);[200, 90, 8];298;רצח;16695;(1, 41, 55, 17, 16695);אשר;3;(1, 41, 55, 62, 62874);ותרעב כל ארץ מצרים ויצעק העם אל פרעה ללחם ויאמר פרעה לכל מצרים לכו אל יוסף אשר יאמר לכם תעשו
(75802, -15, 3);[200, 90, 8];298;רצח;20014;(1, 49, 14, 4, 20014);רבץ;1;(1, 49, 14, 12, 75802);יששכר חמר גרם רבץ בין המשפתים
(102577, -15, 3);[200, 90, 8];298;רצח;27052;(2, 16, 24, 10, 27052);ורמה;2;(2, 16, 24, 35, 102577);ויניחו אתו עד הבקר כאשר צוה משה ולא הבאיש ורמה לא היתה בו
(115491, -15, 3);[200, 90, 8];298;רצח;30538;(2, 26, 5, 12, 30538);במחברת;5;(2, 26, 5, 55, 115491);חמשים ללאת תעשה ביריעה האחת וחמשים ללאת תעשה בקצה היריעה אשר במחברת השנית מקבילת הללאת אשה אל אחתה
(83400, -14, 3);[200, 90, 8];298;רצח;22005;(2, 4, 29, 3, 22005);ואהרן;4;(2, 4, 29, 11, 83400);וילך משה ואהרן ויאספו את כל זקני בני ישראל
(92958, -14, 3);[200, 90, 8];298;רצח;24520;(2, 10, 23, 2, 24520);ראו;1;(2, 10, 23, 3, 92958);לא ראו איש את אחיו ולא קמו איש מתחתיו שלשת ימים ולכל בני ישראל היה אור במושבתם
(145472, -14, 3);[200, 90, 8];298;רצח;38359;(3, 4, 22, 10, 38359);אשר;3;(3, 4, 22, 37, 145472);אשר נשיא יחטא ועשה אחת מכל מצות יהוה אלהיו אשר לא תעשינה בשגגה ואשם
(156356, -14, 3);[200, 90, 8];298;רצח;41258;(3, 11, 23, 7, 41258);רגלים;1;(3, 11, 23, 20, 156356);וכל שרץ העוף אשר לו ארבע רגלים שקץ הוא לכם
(189210, -14, 3);[200, 90, 8];298;רצח;49959;(4, 2, 10, 8, 49959);ראובן;1;(4, 2, 10, 33, 189210);דגל מחנה ראובן תימנה לצבאתם ונשיא לבני ראובן אליצור בן שדיאור
(88476, -13, 3);[200, 90, 8];298;רצח;23310;(2, 8, 10, 4, 23310);חמרם;3;(2, 8, 10, 16, 88476);ויצברו אתם חמרם חמרם ותבאש הארץ
(109098, -13, 3);[200, 90, 8];298;רצח;28836;(2, 21, 25, 9, 28836);חבורה;4;(2, 21, 25, 32, 109098);כויה תחת כויה פצע תחת פצע חבורה תחת חבורה
(111577, -13, 3);[200, 90, 8];298;רצח;29542;(2, 23, 15, 19, 29542);יראו;2;(2, 23, 15, 70, 111577);את חג המצות תשמר שבעת ימים תאכל מצות כאשר צויתך למועד חדש האביב כי בו יצאת ממצרים ולא יראו פני ריקם
(160234, -13, 3);[200, 90, 8];298;רצח;42308;(3, 13, 42, 12, 42308);בקרחתו;3;(3, 13, 42, 44, 160234);וכי יהיה בקרחת או בגבחת נגע לבן אדמדם צרעת פרחת הוא בקרחתו או בגבחתו
(166196, -13, 3);[200, 90, 8];298;רצח;43945;(3, 16, 4, 19, 43945);ורחץ;2;(3, 16, 4, 67, 166196);כתנת בד קדש ילבש ומכנסי בד יהיו על בשרו ובאבנט בד יחגר ובמצנפת בד יצנף בגדי קדש הם ורחץ במים את בשרו ולבשם
(248169, -13, 3);[200, 90, 8];298;רצח;65212;(4, 35, 17, 4, 65212);אשר;3;(4, 35, 17, 12, 248169);ואם באבן יד אשר ימות בה הכהו וימת רצח הוא מות יומת הרצח
(285924, -13, 3);[200, 90, 8];298;רצח;75074;(5, 23, 8, 13, 75074);בארצו;3;(5, 23, 8, 40, 285924);לא תתעב אדמי כי אחיך הוא לא תתעב מצרי כי גר היית בארצו
(57486, -12, 3);[200, 90, 8];298;רצח;15281;(1, 38, 29, 12, 15281);ויקרא;4;(1, 38, 29, 45, 57486);ויהי כמשיב ידו והנה יצא אחיו ותאמר מה פרצת עליך פרץ ויקרא שמו פרץ
(134367, -12, 3);[200, 90, 8];298;רצח;35447;(2, 36, 31, 6, 35447);לקרשי;3;(2, 36, 31, 23, 134367);ויעש בריחי עצי שטים חמשה לקרשי צלע המשכן האחת
(161629, -12, 3);[200, 90, 8];298;רצח;42702;(3, 14, 8, 12, 42702);ואחר;4;(3, 14, 8, 44, 161629);וכבס המטהר את בגדיו וגלח את כל שערו ורחץ במים וטהר ואחר יבוא אל המחנה וישב מחוץ לאהלו שבעת ימים
(205461, -12, 3);[200, 90, 8];298;רצח;54157;(4, 10, 9, 9, 54157);והרעתם;3;(4, 10, 9, 34, 205461);וכי תבאו מלחמה בארצכם על הצר הצרר אתכם והרעתם בחצצרת ונזכרתם לפני יהוה אלהיכם ונושעתם מאיביכם
(251199, -12, 3);[200, 90, 8];298;רצח;66007;(5, 1, 22, 14, 66007);דבר;3;(5, 1, 22, 63, 251199);ותקרבון אלי כלכם ותאמרו נשלחה אנשים לפנינו ויחפרו לנו את הארץ וישבו אתנו דבר את הדרך אשר נעלה בה ואת הערים אשר נבא אליהן
(254221, -12, 3);[200, 90, 8];298;רצח;66788;(5, 2, 32, 3, 66788);לקראתנו;3;(5, 2, 32, 11, 254221);ויצא סיחן לקראתנו הוא וכל עמו למלחמה יהצה
(54823, -11, 3);[200, 90, 8];298;רצח;14595;(1, 37, 14, 13, 14595);דבר;3;(1, 37, 14, 44, 54823);ויאמר לו לך נא ראה את שלום אחיך ואת שלום הצאן והשבני דבר וישלחהו מעמק חברון ויבא שכמה
(145902, -11, 3);[200, 90, 8];298;רצח;38473;(3, 4, 30, 7, 38473);קרנת;2;(3, 4, 30, 26, 145902);ולקח הכהן מדמה באצבעו ונתן על קרנת מזבח העלה ואת כל דמה ישפך אל יסוד המזבח
(256793, -11, 3);[200, 90, 8];298;רצח;67465;(5, 4, 8, 10, 67465);התורה;4;(5, 4, 8, 38, 256793);ומי גוי גדול אשר לו חקים ומשפטים צדיקם ככל התורה הזאת אשר אנכי נתן לפניכם היום
(263481, -11, 3);[200, 90, 8];298;רצח;69171;(5, 7, 15, 10, 69171);אשר;3;(5, 7, 15, 37, 263481);והסיר יהוה ממך כל חלי וכל מדוי מצרים הרעים אשר ידעת לא ישימם בך ונתנם בכל שנאיך
(294526, -11, 3);[200, 90, 8];298;רצח;77320;(5, 28, 57, 15, 77320);אשר;3;(5, 28, 57, 64, 294526);ובשליתה היוצת מבין רגליה ובבניה אשר תלד כי תאכלם בחסר כל בסתר במצור ובמצוק אשר יציק לך איבך בשעריך
(303608, -11, 3);[200, 90, 8];298;רצח;79661;(5, 33, 17, 16, 79661);אפרים;3;(5, 33, 17, 59, 303608);בכור שורו הדר לו וקרני ראם קרניו בהם עמים ינגח יחדו אפסי ארץ והם רבבות אפרים והם אלפי מנשה
(22346, -10, 3);[200, 90, 8];298;רצח;5955;(1, 19, 3, 4, 5955);ויסרו;4;(1, 19, 3, 14, 22346);ויפצר בם מאד ויסרו אליו ויבאו אל ביתו ויעש להם משתה ומצות אפה ויאכלו
(65619, -10, 3);[200, 90, 8];298;רצח;17407;(1, 43, 11, 14, 17407);והורידו;4;(1, 43, 11, 55, 65619);ויאמר אלהם ישראל אביהם אם כן אפוא זאת עשו קחו מזמרת הארץ בכליכם והורידו לאיש מנחה מעט צרי ומעט דבש נכאת ולט בטנים ושקדים
(245968, -10, 3);[200, 90, 8];298;רצח;64651;(4, 33, 54, 19, 64651);הגורל;4;(4, 33, 54, 76, 245968);והתנחלתם את הארץ בגורל למשפחתיכם לרב תרבו את נחלתו ולמעט תמעיט את נחלתו אל אשר יצא לו שמה הגורל לו יהיה למטות אבתיכם תתנחלו
(266212, -10, 3);[200, 90, 8];298;רצח;69868;(5, 9, 12, 14, 69868);סרו;2;(5, 9, 12, 47, 266212);ויאמר יהוה אלי קום רד מהר מזה כי שחת עמך אשר הוצאת ממצרים סרו מהר מן הדרך אשר צויתם עשו להם מסכה
(54991, -9, 3);[200, 90, 8];298;רצח;14637;(1, 37, 18, 1, 14637);ויראו;3;(1, 37, 18, 3, 54991);ויראו אתו מרחק ובטרם יקרב אליהם ויתנכלו אתו להמיתו
(169685, -9, 3);[200, 90, 8];298;רצח;44900;(3, 18, 18, 8, 44900);ערותה;2;(3, 18, 18, 26, 169685);ואשה אל אחתה לא תקח לצרר לגלות ערותה עליה בחייה
(210080, -9, 3);[200, 90, 8];298;רצח;55374;(4, 13, 20, 2, 55374);הארץ;3;(4, 13, 20, 6, 210080);ומה הארץ השמנה הוא אם רזה היש בה עץ אם אין והתחזקתם ולקחתם מפרי הארץ והימים ימי בכורי ענבים
(21039, -8, 3);[200, 90, 8];298;רצח;5624;(1, 18, 12, 3, 5624);בקרבה;3;(1, 18, 12, 11, 21039);ותצחק שרה בקרבה לאמר אחרי בלתי היתה לי עדנה ואדני זקן
(100279, -8, 3);[200, 90, 8];298;רצח;26443;(2, 15, 10, 6, 26443);כעופרת;5;(2, 15, 10, 24, 100279);נשפת ברוחך כסמו ים צללו כעופרת במים אדירים
(134763, -8, 3);[200, 90, 8];298;רצח;35543;(2, 37, 1, 4, 35543);הארן;3;(2, 37, 1, 14, 134763);ויעש בצלאל את הארן עצי שטים אמתים וחצי ארכו ואמה וחצי רחבו ואמה וחצי קמתו
(244299, -8, 3);[200, 90, 8];298;רצח;64259;(4, 33, 3, 14, 64259);ישראל;3;(4, 33, 3, 61, 244299);ויסעו מרעמסס בחדש הראשון בחמשה עשר יום לחדש הראשון ממחרת הפסח יצאו בני ישראל ביד רמה לעיני כל מצרים
(125926, -7, 3);[200, 90, 8];298;רצח;33212;(2, 32, 4, 5, 33212);בחרט;3;(2, 32, 4, 18, 125926);ויקח מידם ויצר אתו בחרט ויעשהו עגל מסכה ויאמרו אלה אלהיך ישראל אשר העלוך מארץ מצרים
(145388, -7, 3);[200, 90, 8];298;רצח;38336;(3, 4, 21, 3, 38336);הפר;3;(3, 4, 21, 11, 145388);והוציא את הפר אל מחוץ למחנה ושרף אתו כאשר שרף את הפר הראשון חטאת הקהל הוא
