(n,d,k);LetterGematriaNumberValue;Letter;LetterPositionIndex;LetterCoordinatesD5K;Found in Word in Text;LetterPositionIndex In Word;WordNumber;WordCoordinatesDWTK;WordNumberInVerse;Found In Verse
(129201, 27, 5);10;י;129201;(2, 34, 4, 8, 129201);שני;3;34104;(2, 34, 4, 2, 34104);2;ויפסל שני לחת אבנים כראשנים וישכם משה בבקר ויעל אל הר סיני כאשר צוה יהוה אתו ויקח בידו שני לחת אבנים
(129201, 27, 5);200;ר;129228;(2, 34, 4, 35, 129228);בבקר;4;34110;(2, 34, 4, 8, 34110);8;ויפסל שני לחת אבנים כראשנים וישכם משה בבקר ויעל אל הר סיני כאשר צוה יהוה אתו ויקח בידו שני לחת אבנים
(129201, 27, 5);6;ו;129255;(2, 34, 4, 62, 129255);ויקח;1;34119;(2, 34, 4, 17, 34119);17;ויפסל שני לחת אבנים כראשנים וישכם משה בבקר ויעל אל הר סיני כאשר צוה יהוה אתו ויקח בידו שני לחת אבנים
(129201, 27, 5);2;ב;129282;(2, 34, 5, 9, 129282);בענן;1;34126;(2, 34, 5, 3, 34126);3;וירד יהוה בענן ויתיצב עמו שם ויקרא בשם יהוה
(129201, 27, 5);6;ו;129309;(2, 34, 6, 1, 129309);ויעבר;1;34133;(2, 34, 6, 1, 34133);1;ויעבר יהוה על פניו ויקרא יהוה יהוה אל רחום וחנון ארך אפים ורב חסד ואמת
