(n,d,k);LetterGematriaNumberValue;Letter;LetterPositionIndex;LetterCoordinatesD5K;Found in Word in Text;LetterPositionIndex In Word;WordNumber;WordCoordinatesDWTK;WordNumberInVerse;Found In Verse
(244695, 59, 5);10;י;244695;(4, 33, 14, 2, 244695);ויסעו;2;64354;(4, 33, 14, 1, 64354);1;ויסעו מאלוש ויחנו ברפידם ולא היה שם מים לעם לשתות
(244695, 59, 5);200;ר;244754;(4, 33, 15, 21, 244754);במדבר;5;64367;(4, 33, 15, 4, 64367);4;ויסעו מרפידם ויחנו במדבר סיני
(244695, 59, 5);6;ו;244813;(4, 33, 18, 1, 244813);ויסעו;1;64380;(4, 33, 18, 1, 64380);1;ויסעו מחצרת ויחנו ברתמה
(244695, 59, 5);2;ב;244872;(4, 33, 20, 18, 244872);בלבנה;1;64393;(4, 33, 20, 5, 64393);5;ויסעו מרמן פרץ ויחנו בלבנה
(244695, 59, 5);6;ו;244931;(4, 33, 23, 16, 244931);ויחנו;5;64404;(4, 33, 23, 3, 64404);3;ויסעו מקהלתה ויחנו בהר שפר
