(n,d,k);LetterGematriaNumberValue;Letter;LetterPositionIndex;LetterCoordinatesD5K;Found in Word in Text;LetterPositionIndex In Word;WordNumber;WordCoordinatesDWTK;WordNumberInVerse;Found In Verse
(66468, 99, 5);10;י;66468;(1, 43, 24, 57, 66468);לחמריהם;5;17610;(1, 43, 24, 13, 17610);13;ויבא האיש את האנשים ביתה יוסף ויתן מים וירחצו רגליהם ויתן מספוא לחמריהם
(66468, 99, 5);200;ר;66567;(1, 43, 26, 51, 66567);ארצה;2;17636;(1, 43, 26, 13, 17636);13;ויבא יוסף הביתה ויביאו לו את המנחה אשר בידם הביתה וישתחוו לו ארצה
(66468, 99, 5);6;ו;66666;(1, 43, 29, 10, 66666);וירא;1;17658;(1, 43, 29, 3, 17658);3;וישא עיניו וירא את בנימין אחיו בן אמו ויאמר הזה אחיכם הקטן אשר אמרתם אלי ויאמר אלהים יחנך בני
(66468, 99, 5);2;ב;66765;(1, 43, 30, 34, 66765);לבכות;2;17683;(1, 43, 30, 9, 17683);9;וימהר יוסף כי נכמרו רחמיו אל אחיו ויבקש לבכות ויבא החדרה ויבך שמה
(66468, 99, 5);6;ו;66864;(1, 43, 32, 49, 66864);יוכלון;5;17706;(1, 43, 32, 12, 17706);12;וישימו לו לבדו ולהם לבדם ולמצרים האכלים אתו לבדם כי לא יוכלון המצרים לאכל את העברים לחם כי תועבה הוא למצרים
